{"$id":"https://surfaces.dev/schemas/source-family-layout-mapping/source-family-layout-mapping-fixture.v0.schema.json","$schema":"https://json-schema.org/draft/2020-12/schema","additionalProperties":false,"properties":{"caseType":{"enum":["valid-layout","review-required","mapping-hash-mismatch","source-hash-mismatch","mapping-incomplete","mapping-collision","physical-path-unsafe","physical-hardlink-forbidden","logical-path-unsupported","physical-file-undeclared","staged-byte-mismatch","transform-forbidden","canonical-ref-mismatch","compiler-hash-mismatch","compiler-run-failed","authority-expansion","inner-evidence-invalid","evidence-hash-mismatch"]},"fixtureId":{"type":"string"},"mutation":{"anyOf":[{"additionalProperties":false,"properties":{"operation":{"enum":["replace-value","replace-byte","remove-row","add-hardlink","add-file","add-field","replace-hash","remove-file"]},"path":{"type":["string","null"]},"secondaryPath":{"type":["string","null"]},"target":{"enum":["mapping-descriptor","physical-source","staged-logical-source","compiler-ref","probe-workspace","captured-inner-evidence","final-evidence"]},"value":{}},"required":["target","operation","path","secondaryPath","value"],"type":"object"},{"type":"null"}]},"provenance":{"additionalProperties":false,"properties":{"generatedAt":{"const":"1970-01-01T00:00:00.000Z"},"generator":{"minLength":1,"type":"string"},"sourceRefs":{"items":{"minLength":1,"type":"string"},"type":"array"}},"required":["generatedAt","generator","sourceRefs"],"type":"object"},"review":{"anyOf":[{"additionalProperties":false,"properties":{"exceptionId":{"type":"string"},"executable":{"const":false},"expiresAt":{"type":"string"},"owner":{"type":"string"},"rationale":{"type":"string"},"requiredRefs":{"items":{"type":"string"},"minItems":1,"type":"array","uniqueItems":true}},"required":["exceptionId","owner","rationale","expiresAt","requiredRefs","executable"],"type":"object"},{"type":"null"}]},"schemaId":{"const":"source-family-layout-mapping-fixture.v0"},"version":{"const":"0.0.0"}},"required":["schemaId","version","fixtureId","caseType","mutation","review","provenance"],"type":"object"}