{"caseType":"valid-layout","fixtureId":"alternate-layout","mutation":null,"provenance":{"generatedAt":"1970-01-01T00:00:00.000Z","generator":"interfacectl-source-family-layout-mapping-materialize","sourceRefs":["fixtures/source-family-layout-mapping/layout-package.fixture.json"]},"review":null,"schemaId":"source-family-layout-mapping-fixture.v0","version":"0.0.0"}