{"caseType":"evidence-hash-mismatch","fixtureId":"evidence-hash-mismatch","mutation":{"operation":"replace-hash","path":"artifacts/10/hash","secondaryPath":null,"target":"final-evidence","value":"0000000000000000000000000000000000000000000000000000000000000000"},"provenance":{"generatedAt":"1970-01-01T00:00:00.000Z","generator":"interfacectl-source-family-layout-mapping-materialize","sourceRefs":["fixtures/source-family-layout-mapping/layout-package.fixture.json"]},"review":null,"schemaId":"source-family-layout-mapping-fixture.v0","version":"0.0.0"}